Confirmed,Id,Source,KOR
,"830470301","不过啊，我要是能亲手结束掉这场战争，也就不需要让她们去战斗了吧。","그러나 아, 내 손으로 이 전쟁을 끝낼 수 있다면 굳이 싸울 필요가 없겠지요."
,"830470400","我平时绷得太紧了？我知道你很关心手下的AG，但不需要把注意力都放在我身上。","내가 평소에 너무 팽팽하게 당긴다.당신이 AG 밑에 있는 것에 관심이 많은 것은 알지만 나에게만 집중할 필요는 없다."
,"830470401","我从小就被当成军人培养，与其说我绷得太紧，不如说我从来都没有放松过吧。","어릴 때부터 군인 취급을 받았는데 너무 긴장해서라기보다 긴장을 풀지 않았다."
,"830470402","面对战斗，只要稍微松懈就会丢掉性命，战场就是这么残酷的地方。","조금만 방심해도 목숨을 잃을 정도로 전투가 혹독한 곳이다."
,"830470500","哎？你还给我安排了休假？指挥官你啊……真是在我接触过的所有长官里，最特别的那个呢。","어휴 휴가까지 주선해 주셨어요?지휘관 너야… 내가 접촉한 모든 장관 중에서 가장 특별했던 거였어."
,"830470501","无论是谁都告诉我要刻苦努力，战斗一定要获胜，不能有半点松懈。","누구든 열심히 싸워 꼭 이겨라, 한 치의 방심도 없어야 한다고 말한다."
,"830470502","不过，或许正如你所说，我也感觉到有一丝疲倦了吧，你的好意我就接受了。","하지만 말했듯이 나도 조금 피곤해졌는지 당신의 호의를 받아들이겠습니다."
,"830470503","每天都在前线厮杀的我，确实需要休息一会了……指挥官，你今天也给自己放个假吧。","매일 전선에서 싸우고 있는 나는 확실히 좀 쉬어야 한다…. 지휘관, 오늘도 휴가를 내라."
,"830470600","指挥官也要好好护理一下自己的头发了吧？这可是相当重要的一环。你的形象代表了我们整个舰队，要是让人看到你这样的发质可不行！","지휘관도 머리를 잘 관리해야겠죠?상당히 중요한 일환이다.너의 이미지는 우리 전체 함대를 대표한다. 만약 사람들에게 너의 이러한 머리질을 보여주면 안 된다!"
,"830470601","喏，指挥官你就试试这款护发素吧，舰船上的沐浴用品质量实在不过关。","자, 지휘관 이 린스를 써봐라, 함선의 목욕용품의 질이 정말 대단하단다."
,"830470602","唉，看来还是让我来采购舰船上的沐浴用品吧，下次我就向采购部门提出申请。","아휴, 아무래도 내가 함선의 목욕용품을 구매하도록 할까 봐 다음에는 구매처에 신청하겠다."
,"830480100","指挥官，你刚刚是在看着我吗？我是知道的，因为我对其他人的视线相当敏感。","지휘관, 아까 날 보고 있었던 거야?나는 다른 사람들의 시선에 상당히 민감하기 때문에 알고 있다."
,"830480101","所以我比较喜欢待在那些不起眼的角落，这样我会舒服一些。","그래서 볼품없는 구석에서 지내는 게 편하다."
,"830480200","指挥官，找我有什么事吗？嗯？我经常吓到其他的AG？","지휘관, 나한테 무슨 볼일이라도 있는 거야?응 내가 다른 AG 많이 놀래?"
,"830480201","不好意思，我会尽量收起自己的气息，让她们更难发现我一些。","미안하지만 내 기운을 최대한 거두어 그들이 나를 발견하기 어렵게 만들겠다."
,"830480202","嗯？是让我多去和她们交流？这个啊，我不保证自己能做得到……","응? 얘네들과 더 많이 교류하라는 거야?글쎄, 내가 할 수 있다는 보장은 없는데..."
,"830480300","你让我多点在别人面前露脸吗？我明白你的意思……但我想保持自己这份稀薄的存在感。","너 나보고 남들 앞에 좀 더 얼굴을 내밀라고?당신의 뜻은 알겠는데…. 하지만 희박한 존재감을 유지하고 싶어요."
,"830480301","因为任务的需要，我刻意抑制自己的气息，而且我也并不喜欢引人瞩目……","임무 때문에 숨죽이고, 눈에 띄는 것도 싫어하고."
,"830480302","但既然是指挥官的想法，我也会尝试着去克服的。","그러나 지휘관의 생각인 만큼 극복해 보겠다."
,"830480400","最近我总是被安排在指挥官身边。","요즘 나는 늘 지휘관 곁에 배치돼 있다."
,"830480401","能得到你的重视当然是一份高兴的事情，但我不清楚自己到底适不适合担任这份工作，因为要经常和其他AG进行接触……","당신이 소중히 여기는 것은 물론 기쁜 일이지만, 내가 이 일을 할 적임자인지 모르겠고, 다른 AG와 자주 접촉해야 하기 때문에..."
,"830480402","不，我并不讨厌这样。只是很少和其他人进行这种接触，既让我感到新鲜也让我有些害怕……","아니오,나는 결코 싫지 않아요.다만 다른 사람들과 접촉하는 일이 드물어 신선하기도 하고 두렵기도 하고…."
,"830480500","我，有了些变化？嗯……的确是的。","나, 좀 변했어?음…맞아."
,"830480501","自从在指挥官身边的工作，似乎不再那么害怕其他AG的视线了，与她们进行交流也很开心，大家一直都很照顾我的心情……","지휘관 곁에서 일하면서 다른 AG의 시선이 두렵지 않은 듯 그들과 교류하는 것도 즐겁고, 항상 배려해주는 마음인데…"
,"830480502","呃，指挥官，那个，还请不要这么直视着我，虽然我已经在克服这个缺点了，但被你这么直视的话果然还是有些……","어, 지휘관님, 저, 저를 그렇게 똑바로 쳐다보진 말아주세요. 저는 이미 그 단점을 극복하고 있지만, 당신한테 그렇게 직시당하면 역시 좀..."
,"830480503","唔，总而言之，请继续把我安排在你的身边吧。","음, 요컨대 나를 계속 당신 곁에 배치해 주세요."
,"830480600","嗯？指挥官，你是什么时候……我只是顺手找了本书翻一翻而已。","응 지휘관, 너 언제...난 그냥 책 한 장 뒤적거렸을 뿐이야."
,"830480601","你很在意吗？那就给你也读一读吧……只是这本书上记叙的知识太浅薄了，想要学会交际的技巧果然没那么简单。","신경 쓰이세요? 그럼 읽어드리죠… 다만 이 책에 기술된 지식이 너무 얕아서 교제하는 기술을 배우기란 쉽지 않습니다."
,"830480602","我想，还是需要指挥官你来教一教我，比如其他AG都对什么样的话题感兴趣之类的……","다른 AG들이 어떤 이슈에 관심을 갖고 있는지 지휘관이 가르쳐줘야겠다고 생각했다."
,"830480603","所以，你接下来还有时间吗？希望你能陪我练习一下……","그래서 너 아직 시간 있니?연습 좀 해줬으면 좋겠는데..."
,"830500100","我一向不认为基于情感而达成的关系，那无非是两个人彼此相互索取相互麻痹……","감정적으로 맺어진 관계라고 생각하지 않고 서로가 서로를 마비시키는 것뿐인데..."
,"830500101","我们？我们当然是上下级关系……只是我们偶尔会就学术问题进行讨论。","우리? 상하관계죠. 다만 우리는 가끔씩 학술문제에 대해 토론합니다."
,"830500200","我擅长很多学科，无论是理论物理学还是光量子科学……除了处理情感关系。那实在是太麻烦了……两个智慧生物之间相互试探交换某种利益……","이론물리학이든 광양자과학이든 감정관계 말고는 여러가지 학과를 잘합니다.그건 정말 귀찮아. 두 지혜로운 생물이 서로 어떤 이익을 주고받으려고 떠보는데."
,"830500201","所以，你能帮我挡下其中大部分，我很感谢。","그래서 그 대부분을 막아줘서 고맙다."
,"830500300","帮我记录一下实验数据，这些东西可比一两场战斗要重要得多……","실험 데이터 좀 적어주세요. 한두 번의 싸움보다 훨씬 중요한 것들인데..."
,"830500301","虽然你的成就可能只是“最出色的指挥官”之类的，不过，当我站在科学界最高的领奖台上，我会在致谢名单上提到你的。","당신의 업적은 '가장 뛰어난 지휘관'일 수 있지만, 내가 과학계의 가장 높은 시상대에 선다면 인사 명단에 당신을 언급할 것이다."
,"830500400","我在看一位科学家的传记，她用了整整两章去讲述自己和伴侣之间的经历对自身价值的影响。","한 과학자의 전기를 보면서 그녀는 자신과 배우자 사이의 경험이 자신의 가치에 미치는 영향을 두 장에 걸쳐 이야기했다."
,"830500401","在我来这里之前，也许我还不能理解这件事，不过现在……就算是一知半解吧。","내가 여기 오기 전까진 이해 못했을지 모르지만, 지금은…다 알고 있다고 해도."
,"830500402","但是，作为科学家，我可不能接受“一知半解”。我会继续去研究这件事的，或许会多花些时间。","하지만 과학자로서 수박 겉핥기 식으로는 받아들일 수 없다.나는 이 일을 계속 연구할 것이다.아마도 시간이 좀 더 걸릴 것이다."
,"830500500","我想……我们之间有一些无法被测试、无法用数据分析的情感。","우리 사이에는 테스트를 받을 수 없고, 데이터로는 분석할 수 없는 감정이 있다고 생각한다."
,"830500501","如果一定要我给它下一个定义，那就是，当我在荒漠中跋涉，或因研究傀儡行为学而深入沦陷区……","내가 굳이 정의를 내려야 한다면, 내가 사막 한가운데를 돌아다녔거나, 괴뢰 행동학을 연구하다 함락된 지역에…"
,"830500502","总之，在我生还几率十分渺茫的时候，我希望你能在我身边，哪怕你只是和平常那样，用无知但可爱的眼神看着我也好。","어쨌든 내 생환 확률은 희박할 때, 나는 네가 내 곁에 있었으면 좋겠어. 네가 평소와 같이 무식하지만 귀여운 눈빛으로 날 바라봐 줘도 좋겠어."
,"830500600","好吧，我似乎能理解“亲密关系”对普通人的意义了。","자, '친밀한 관계'가 일반인에게 갖는 의미를 이해할 수 있을 것 같다."
,"830500601","但我不是普通人，严格来说，我是搭载了「质量投影」设备的深度改造者，普通这个词可跟我没关系…","하지만 저는 보통 사람이 아닙니다. 엄밀히 말하면 품질 프로젝터를 탑재한 심도 있는 개조자입니다. 보통이라는 단어는 저와 관계가 없습니다…"
,"830500602","嗯，我的意思是，我会考虑这种情感依存症对你的重要性并把它放到我的实验清单上。","음, 이런 감정의존증이 당신에게 얼마나 중요한지 생각해 내 실험 리스트에 올리겠다는 뜻입니다."
,"830500603","这个东西就作为实验的催化剂吧，虽然只是个普通的镶嵌有碳元素晶体的金属环而已。","이것은 실험의 촉매제로 삼아야 한다. 비록 보통 탄소 결정체가 박혀 있는 금속 고리일 뿐이지만."
,"830520100","指挥官和红莲，似乎有一种相似的气息……不好意思，我也不知道该怎么解释。","지휘관과 홍련, 비슷한 기운이 감도는 듯…. 미안하지만 나도 어떻게 설명해야 할지 모르겠다."
,"830520101","只是我有一种，我能在指挥官身上学到什么的感觉，就像当初红莲那样……","다만 내가 지휘관에게 무언가를 배울 수 있다는 느낌은, 홍련이 그랬던 것처럼…."
,"830520200","没错，当初是红莲教会了我战斗。","맞아, 홍련이 내게 싸움을 가르쳐 주었거든."
,"830520201","在那之前，我就已经被改造为AG了，但那时的我，不过是个只懂挥刀的人偶罢了。","그 전부터 AG로 개조됐지만 그때의 나는 칼만 잘 휘두르는 인형에 불과했다."
,"830520202","那根本算不上战斗。后来我与红莲相遇，成为了七武士之一，我才终于明白……","그것은 근본적으로 전투라고 할 수 없다.나중에 홍련과 만나 7무사의 한 사람이 되고 나서야 비로소 알게 되었는데..."
,"830520300","在七武士中，我似乎比较擅长计算和整理。","칠무사 중에서 나는 계산과 정리를 잘하는 것 같다."
,"830520301","于是就由我来负责物资管理，资金规划，以及照顾大家的日常起居，下厨等等……","그래서 제가 물자 관리, 자금 계획, 여러분의 일상 생활, 요리까지..."
,"830520302","但是，大家总是非常客气，让我不要做这么多，其实她们，是不是不太喜欢我呢……","근데 다들 너무 많이 하지 말라며 겸손해하시는데 사실 저 안 좋아하시는 거 아닌가요..."
,"830520400","咦？您是说这不是客气，而是在“敬爱”我吗？这是真的吗……","어? 예의가 아니라 나를 '경애'하는 거라는 말씀이세요?이게 사실일까..."
,"830520401","其实，我知道自己不擅长表达，也做不出丰富的表情，所以一直都很担心，我会不会被大家讨厌……","사실 표현도 서툴고 표정도 풍부하지 않은 걸 알고 있기 때문에 미움 받지 않을까 걱정도 많이 했는데..."
,"830520402","现在指挥官告诉了我大家的想法，我终于也能安心了，非常感谢您。","이제 지휘관이 여러분의 생각을 알려주셔서 저도 안심할 수 있었습니다."
,"830520500","能够与大家相遇，我觉得自己真的很幸运。但是就算您说，我可以表现得再高兴一些，我也不知道该怎么办……","여러분을 만나게 돼 정말 운이 좋다고 생각해요.근데 제가 좀 더 기뻐할 수 있다고 해도 어떻게 해야 할지..."
,"830520501","要先从“笑容”开始，是吗？好吧，我试试看……","'웃음'부터 시작해야 하는 것 아닌가.그래 내가 한번 해볼게..."
,"830520502","呵、呵呵呵……指挥官，我这样对吗？","흐흐흐…지휘관님, 제가 그랬던가요?"
,"830520503","唔……不好意思，看来我还需要多加练习……","ㅎㅎ 미안하지만 아직 좀 더 연습해야 할 것 같은데...."
,"830520600","指挥官，那个，有件东西希望您收下……是我的书法作品。","지휘관, 저기, 받아주시기 바랍니다… 제 서예 작품입니다."
,"830520601","我之前说，我似乎能在指挥官身上学到什么，现在我明白了。","나는 내가 지휘관에게 무언가를 배울 수 있을 것 같다고 말했는데, 이제 알겠다."
,"830520602","是您教会了我放下刀剑，享受平静的时光，教会我抬起双眼，坦率地与同伴们交流，现在的我充满细微的幸福……","칼과 검을 내려놓고 평온한 시간을 즐기는 법을 가르쳐 주신 당신, 눈을 들어 동료들과 솔직하게 이야기하는 법을 가르쳐 주신 당신, 지금의 나는 작은 행복으로 가득합니다…"
,"830520603","这都是多亏了您，是您教会了我“生活”。","모두 당신 덕분이에요. 저에게 '삶'을 가르쳐 주신 거예요."
,"830520604","所以我为您写了这个词语，我认为，这是最适合您的。","그래서 제가 당신을 위해서 이 단어를 썼는데, 이것이 당신에게 가장 적합하다고 생각합니다."
,"830530100","这就是我「辉煌孔雀」帕芙妮丝的辉光，怎么，感受到我的美丽与强大了吗？","이것이 바로 저의 “휘황한 공작” 파프니스의 휘광입니다. 어떻게 저의 아름다움과 강함을 느끼나요?"
,"830530101","不错，看来你很有眼光，既然你还想为我献上赞美，那我就把力量借给你吧！","그래, 안목이 있나 봐, 나를 위해 칭찬을 더 하고 싶으면, 힘을 빌려줄게!"
,"830530200","“指挥官”？哼，真是个傲慢的名号，我的美丽无人可以比拟，我的光芒无人可以驾驭，又怎么是你可以随意“指挥”的呢。","'지휘관'? 흥, 내 아름다움은 누구도 따를 수 없고, 내 빛은 아무도 따를 수 없는데, 어찌 네가 마음대로 '지휘'할 수 있겠느냐."
,"830530201","别再以此自居了，认清你的地位，并感谢我的宽宏吧！","더 이상 이렇게 자처하지 말고, 너의 지위를 분명히 인식하고, 나의 관대함에 감사해라."
,"830530300","怎么了，为什么你忘了赞美我，还要避开我的光辉？难道是被它灼伤了吗？","왜, 왜 너는 나를 칭찬하는 것을 잊어버리고, 나의 빛을 피하려고 하니?화상을 입었단 말인가."
,"830530301","那可不行，我的光辉永远炙热，永不黯淡，既然你想留在我的左右，继续借用我的力量，你就必须习惯它！","그러면 안 된다. 나의 빛은 영원히 뜨거우며, 영원히 어둡지 않다. 기왕 당신이 내 좌우에 남아 계속 내 힘을 빌리고 싶다면, 당신은 반드시 그것에 익숙해져야 한다!"
,"830530400","习惯我的光芒了吗？很好，很好，看来你已经明白了——","내 빛에 익숙해졌니?좋아 좋아, 좋아, 넌 알고 있나 봐-"
,"830530401","在这灰暗且丑陋的世界上，我「辉煌孔雀」才是唯一不灭的光！","이 어둡고 추한 세상에서, 나는 휘황찬란한 공작만이 유일하게 꺼지지 않는 빛입니다!"
,"830530402","好了，你就继续直视我、赞颂我，并借用我的光，用它照耀你想照耀之地吧！","자, 너는 나를 똑바로 보고 찬양하고, 나의 빛을 빌어, 네가 비추고 싶은 곳을 비춰라!"
,"830530500","终结战争，守护世界，这不过是一些无足轻重的小事。","전쟁을 종식시키고 세계를 수호하는 것은 대수롭지 않은 일이다."
,"830530501","只要借助我的力量，你的所有愿望都可以实现。没错，你已经获得了我的认同。","나의 힘만 빌리면 당신의 모든 소원은 이루어질 수 있습니다.그래, 너는 이미 나의 동의를 얻었다."
,"830530502","你那发自内心的赞颂、那追求美丽的执着让我刮目相看，我的盟友啊，为自己而庆幸，为自己而光荣吧！","내 마음에서 우러나오는 찬사, 그 아름다움에 대한 집착이 나를 다시 보게 하소서, 나의 맹우여, 나를 위해 다행이오, 나를 위해 영광이오!"
,"830530600","你又为我费心了呢，虽然依旧简陋，但礼节与心意足以弥补了，我很满意。","너는 또 나를 위해 애썼구나, 비록 여전히 누추하지만, 예의와 마음은 충분히 메웠으니, 나는 매우 만족한다."
,"830530601","既然如此，我就把这尊「辉煌孔雀」的小雕像送给你，作为你的嘉奖吧。","기왕 이렇게 된 이상 나는 이 휘황찬란한 공작의 작은 조각상을 당신에게 표창으로 드립니다."
,"830530602","嗯？为什么要困惑，不用怀疑，这确实是依照我的美貌而打造的。","응? 왜 곤혹스러워. 의심할 필요 없어. 이건 확실히 내 미모에 따른 거야."
,"830530603","好了，你拿去吧，把它放在你的办公桌上。如果我暂时离开你了，你就把它当作我的分身，继续向我表达赞美吧！","됐어,네가 가져가라,그것을 너의 책상 위에 놓아라.만약 내가 잠시 너를 떠났다면, 너는 그것을 나의 분신으로 여기고, 계속 나에게 찬미를 표시해라!"
,"830550100","回想起来，我已经和指挥官您共事过一段时间了，不知道您满不满意呢？","돌이켜보면 지휘관님과 함께 일한 지 꽤 되었는데 마음에 드셨는지 모르겠네요."
,"830550101","我对自己的能力还不是很有信心，希望指挥官多多指出我的不足之处。","나는 아직 능력을 자신하지 못했고, 지휘관들이 나의 부족한 점을 많이 지적해 주길 바란다."
,"830550200","教官的训练相当严格，我有时候会感觉到，自己没有办法跟上她和同僚们的脚步，也许我真的不适合改造成AG……","교관의 훈련이 워낙 까다로워 동료들과 따라갈 수 없는 내가 정말 AG로 개조하기에는 부적합한 것 같다는 생각이 들 때가 있는데."
,"830550201","指挥官，您是怎么认为的呢？","지휘관, 어떻게 생각하십니까?"
,"830550300","也许指挥官已经知道了，我和教官其实是亲生姐妹……","지휘관은 이미 알고 있었겠지만, 나와 교관은 사실 친자매였으니…."
,"830550301","但这并不是我应该拿出来说的事情。教官的战绩比起我要优秀许多，而我恐怕……就连她的背影都难以触及。","하지만 내가 내놓을 일은 아니다.교관의 전적은 나보다 훨씬 뛰어나지만, 나는 아마…. 뒷모습조차 만질 수 없을 것이다."
,"830550400","在学院的期间，教官和我也一直向大家隐瞒着姐妹关系。","학원에 있는 동안에도 교관과 저는 자매관계를 숨기고 있었습니다."
,"830550401","一方面是我的战绩远不及她出色，另一方面，我也不想给自己的家族、给教官她蒙羞。","내 성적이 그에 못 미치는 데다 내 가족, 교관에게 수모를 주고 싶지 않다."
,"830550402","我作为妹妹的同时，也是一名军人，必须要拿出更出色的战绩才行……","동생인 동시에 군인이기 때문에 더 좋은 성적을 내야 하는데…"
,"830550500","实际上，我是一个不喜欢争斗的人，每次听到要派往战场，内心都会有些抵触……但这样是不行的。","사실 나는 싸움을 싫어하는 사람이라 전쟁터에 보낸다는 말을 들을 때마다 내심 저항을 하는데…. 그래선 안 된다."
,"830550501","我必须更努力地争取战绩与荣耀，至少要追赶上姐姐的脚步。只有这样，我才有资格作为她的妹妹和她相认。","전적과 영광은 더 열심히 해서 누나의 발걸음을 따라가야 한다.오직 이렇게 해야만,나는 그녀의 여동생으로서 그녀와 서로 알 수 있는 자격이 있다."
,"830550502","目前的我还远远没有这个能力，还请指挥官继续见证我的成长，直到我能自豪地称呼教官为“姐姐”的那一天。","내가 교관을 자랑스레 '누나'라고 부를 수 있는 날까지 지휘관에게 성장 과정을 지켜봐 달라고 부탁했다."
,"830550600","指挥官，这个给您，这是我还年幼时，姐姐送给我的一个小挂件……","지휘관, 여기 있습니다. 제가 어렸을 때 누나가 선물한 작은 걸개인데..."
,"830550601","虽然我已经戴了很久了，但我想让您暂时保管一下。","착용한 지 오래됐지만 잠시 보관해 두시라고 하겠습니다."
,"830550602","等到未来的哪一天，我被指挥官和姐姐认可的时候，能请您再把这个挂件送回给我吗？","앞으로 제가 지휘관과 누나의 허락을 받을 때까지 이 걸기를 다시 보내주시겠습니까?"
,"830550603","这个挂件对于现在的我来说，还太沉重了。","이 걸이는 지금의 나에게는 너무 무겁다."
,"830560100","哎呀！卡西我比较笨嘛！很多东西都弄不太明白……","아이고! 카시는 내가 좀 둔하구나!잘 모르는 게 많은데..."
,"830560101","指挥官一定要多教教我啊！不然我就越来越笨了！","지휘관 많이 가르쳐 주세요!그렇지 않으면 나는 점점 더 둔해질 것이다!"
,"830560200","咦？指挥官是不喜欢恶作剧吗？我是不是该告诉凯蒂她们比较好？","어 지휘관은 장난을 싫어하나?내가 케이티에게 그녀들이 비교적 좋다고 알려야 하지 않겠니?"
,"830560201","不用吗？指挥官可不要憋在心里哦！我碰到不顺心的事情都会向凯蒂和缇米说的！","아니야 지휘관은 마음에 담아두지 마!내가 마음에 안 드는 일이 있으면 케이티와 티미에게 다 말해줄게!"
,"830560300","我和凯蒂与缇米的关系？唔——应该算是认识很久的朋友？","나와 케이티와 티미의 사이는?-오랫동안 알고 지낸 친구인데."
,"830560301","我记得有个一个词是可以形容我和她们之间的关系……“挚友”？","내가 기억하는 단어 중에 나와 그녀들의 관계를… '절친'?"
,"830560302","唔，好像不太对，卡西不太记得了！等下次想起来再和指挥官说吧！","그래, 별로 안 맞는 것 같아, 카시는 잘 기억하지 못했어!다음에 생각이 나면 지휘관과 이야기하자!"
,"830560400","啊！我终于想起来了！大家都说凯蒂和缇米就像我的姐姐一样，我们就和一家人没什么区别！","아! 드디어 생각났다!케이티와 티미는 우리 언니 같다고들 하는데 우리는 가족이나 다름없다!"
,"830560401","这就是“亲情”吧？我并不讨厌呢！卡西我一直不知道自己的父母是谁，所以一直也不清楚“亲情”到底是什么东西呢。","그게 바로 '친정(親情)'이죠?나는 싫지 않다! 캐시 나는 내 부모가 누구인지 모르기 때문에 '친정'이 도대체 무엇인지 잘 모른다."
,"830560500","凯蒂和缇米也好，指挥官也好，这里的大家都对我都很温柔，还让我学会了好多东西！","케이티와 티미도 그렇고 지휘관도 그렇고 다들 저한테 친절하게 대해주고 배울 것도 많았죠!"
